physical asset,location,ownership,commodity,Countries
Acreage,"Algeria, Al Hosn Gas, Dolphin Oman, Permian Rockies And Other Domestic, Gulf Of Mexico, USA, Powder River Basin, Permian Basin",Occidental Petroleum Corporation,"Oil, Natural Gas","Algeria, Oman, USA"
Automated And Surveillance Systems,,Occidental Petroleum Corporation,"Oil, Natural Gas",
Co-Generation Facilities,"Permian Basin, Texas, Louisiana",Occidental Petroleum Corporation,"Oil, Gas, Electricity, Power",USA
communications network,,"Third Party, Occidental Petroleum Corporation","Oil, Natural Gas",
Compression Equipment,"North Africa, Algeria,  DJ Basin, Permian Basin, Gulf-Coast, USA, Oman, Colorado, Permian, West Virginia, Gulf of Mexico, Rockies","Occidental Petroleum Corporation, OxyChem","Oil, Natural Gas, Chemicals, Ethylene, Coal","Algeria, USA, Oman"
compressors,,Occidental Petroleum Corporation,"Oil, Gas",
Conventional Projects,Permian EOR,Occidental Petroleum Corporation,,USA 
Crude Pipeline,"Gulf Coast, Permian Basin, Qatar, UAE, Oman","Occidental Petroleum Corporation, Delaware Ownedaware Owned","Crude Oil, Natural Gas, Produced Water, Natural Gas Liquid","Qatar, UAE, Oman"
Crude Terminal,Midland To Gulf Coast,Occidental Petroleum Corporation,"Crude Oil,Oil,Produced Water",USA
"Dolphin Pipeline 


Let me know if you'd like to process another cell!","Qatar, UAE, Oman, Permian Basin","Occidental Petroleum Corporation, Delaware Ownedaware Owned","Natural Gas, Produced Water, Natural Gas Liquid, Crude Oil Transportation","Qatar, UAE, Oman"
Domestic Onshore Undeveloped Leases,Onshore USA  Domestic Assets,Occidental Petroleum Corporation,"Oil, Crude Oil, Natural Gas",USA
Easements,,Occidental Petroleum Corporation,"Oil And Gas, Oil And Gas Exploration And Development",
Emissions Control Systems,,Occidental Petroleum Corporation,"Oil, Natural Gas",
"Engineering And Technical Staff Offices In The Woodlands, Texas","The Woodlands, Texas",Occidental Petroleum Corporation,"Oil, Gas",USA
"Exploratory And Development Wells (Being Drilled) 


Let me know when you're ready for the next cell!","USA, International",Occidental Petroleum Corporation,"Oil, Natural Gas",USA
Facilities,"USA, Middle East, Colombia, Permian Basin, Greenway Plaza, Houston, Texas","Occidental Petroleum Corporation, Al Hosn Gas","Oil, Natural Gas, Condensate","USA, Colombia, Middle East"
"Facilities (Marine Shore-Bases In Galveston, Texas, And Port Fourchon, Louisiana, Two Helicopter Bases In Louisiana)","Galveston, Texas; Port Fourchon, Louisiana",Occidental Petroleum Corporation,"Oil, Gas",USA
Federal Lands [In New Mexico And Wyoming],"New Mexico, Wyoming",BLM,"Oil, Gas",USA
Field Equipment,"International, North Africa, INatural Gas Liquideside Facility, DJ Basin, Algeria, Permian Basin, Gulf Coast, Colorado, Oman, West Virginia, Gulf of Mexico, Rockies","Occidental Petroleum Corporation, OxyChem","Oil, Gas, Condensate, Natural Gas Liquids (Natural Gas Liquid), Chemical Raw Materials, Power, Chemicals, Ethylene","Algeria, Oman, USA"
Gas Fields,"USA (Texas, New Mexico, Colorado, Gulf Of Mexico), Oman, United Arab Emirates, Algeria",Occidental Petroleum Corporation,"Natural Gas, Oil","USA, Oman, United Arab Emirates, Algeria"
Gas Plants,"Domestic Sites, International Sites, Texas, New Mexico, Colorado, Permian Basin, California, Delaware Owned, Michigan, New York, Ohio, Tennessee, Washington","Occidental Petroleum Corporation,Third Parties,WES","Oil, Gas, Wet Gas, Natural Gas,  Natural Gas Liquid ",USA
Gas Processing And Compression Plant,Qatar,Delaware Ownedaware Owned,Natural Gas,Qatar
gathering systems,"Domestic Sites, International Sites, Wes Operating, Texas, New Mexico, Colorado, Midland To Gulf Coast","WES, Occidental Petroleum Corporation","Oil, Gas, Natural Gas",USA
Gulf Of Mexico Assets,Gulf of Mexico,"Occidental Petroleum Corporation, Occidental Subsidiaries","Crude Oil, Natural Gas","USA, Mexico"
Horn Mountain West Subsea Development,Gulf Of Mexico,Occidental Petroleum Corporation,"Oil, Gas","USA, Mexico"
Infill Development Projects,Permian Basin,Occidental Petroleum Corporation,,USA
Information And Industrial Control Technology System (N/A),,Occidental Petroleum Corporation,"Oil, Natural Gas",
Information Systems,,Occidental Petroleum Corporation,"Oil, Natural Gas",
infrastructure,"Latin America, Gulf Of Mexico, International Assets, USA Gulf Coast, Rockies, Permian Basin, Utah, Algeria, Powder River Basin, Louisiana, Wyoming, Oman","Occidental Petroleum Corporation, U.S. Government","Oil, Natural Gas","USA, Algeria, Oman"
Lucius And Holstein Facilities,Gulf Of Mexico,Occidental Petroleum Corporation,"Oil, Gas","USA, Mexico"
Manufacturing Plants,"Alabama, Georgia, Illinois, Kansas, Louisiana, Michigan, New Jersey, Ohio, Tennessee, Texas, Canada, Chile","OxyChem, Occidental Petroleum Corporation","Chemicals, Chlorine, Caustic Soda, Chlorinated Organics, Potassium Chemicals, EDC, Chlorinated Isocyanurates, Sodium Silicates, Calcium Chloride, Vinyl Chloride Monomer, Polyvinyl Chloride, Ethylene, Oil, Natural Gas","USA, Canada, Chile"
Midstream And Marketing  [physical assets],,Occidental Petroleum Corporation,"Oil, Natural Gas",
Natural Gas Reserves,"USA, Permian Basin, DJ Basin, Algeria, Oman, Middle East, North Africa, Latin America","Occidental Petroleum Corporation, WES","Natural Gas, Oil","USA, Algeria, Oman, Middle East"
network of pipelines,"UAE, Oman, Midland, Gulf Coast, Texas, New Mexico, Colorado","Delaware Owned, Occidental Petroleum Corporation, WES","Natural Gas, Oil, Carbon, Natural Gas Liquid, Carbon Dioxide, Oil And Gas","UAE, Oman, USA"
Natural Gas Reserves,"USA, International, Permian Basin, DJ Basin, Algeria",Occidental Petroleum Corporation,"Natural Gas, Oil","USA, Algeria"
Offshore and Onshore Drilling Rigs,Gulf Of Mexico,Occidental Petroleum Corporation,"Oil, Gas","USA, Mexico"
Offshore Lease (Sales),"Outer Continental Shelf, Gulf Of Mexico",BOEM,"Oil, Gas",USA
Oil and Gas,"Permian Basin, DJ Basin, Oman, Middle East, North Africa, Latin America, USA, International, Gulf of Mexico, Algeria, South Africa, Canada, Colombia,  Countries Affected By Political Instability, Corruption, Armed Conflict, Terrorism, Insurgency, Civil Unrest, Security Problems, Labor Unrest, OPEC Production Restrictions, Equipment Import Restrictions And Sanctions, Colorado","Occidental Petroleum Corporation, OxyChem","Oil, Natural Gas","Oman, USA, Algeria, South Africa, Canada, Colombia, Middle East"
oil production facilities,,Occidental Petroleum Corporation,"Oil, Natural Gas Liquid, Natural Gas",
Oil Reserves ,"USA, Permian Basin, DJ Basin, Algeria, Gulf Of Mexico, Oman, Middle East, North Africa, Latin America, Powder River Basin, Permian EOR, Greenway Plaza, Suite, Houston, Texas",Occidental Petroleum Corporation,"Oil, Natural Gas","USA, Algeria, Oman, Middle East"
Operations,"Gulf Of Mexico, South Texas, DJ Basin","Occidental Petroleum Corporation,OxyChem","Oil, Gas, Chemicals Derived From Oil And Gas",USA
Permian Basin,"USA, Permian Basin",Occidental Petroleum Corporation,"Oil, Natural Gas",USA
Platforms,Gulf Of Mexico,Occidental Petroleum Corporation,"Oil, Crude Oil, Natural Gas","USA, Mexico"
Power Generation Facility,"Texas, Louisiana","Third Parties, Occidental Petroleum Corporation","Natural Gas, Electricity, Steam",USA
PP&E  ,"North America, Middle East",Occidental Petroleum Corporation,"Oil, Gas, Natural Gas, Chemical Products","USA, Canada, Mexico, Middle East"
Pressure-Maintenance Projects,"USA,International",Occidental Petroleum Corporation,"Oil, Natural Gas",USA
Processing Capacity ,"UAE, Al Hosn","Occidental Petroleum Corporation, Al Hosn Gas","Produced Water, Natural Gas, Sulfur",UAE
"Property, Plant And Equipment","USA, UAE, Oman, Algeria, Colombia, Qatar, Middle East and North Africa, Latin America, Permian Basin, DJ Basin, Countries outside North America",Occidental Petroleum Corporation,"Oil, Natural Gas, Chemical Products","USA, UAE, Oman, Algeria, Colombia, Qatar, Middle East"
Properties ,"USA, Permian Basin, International, Algeria",Occidental Petroleum Corporation,"Oil, Natural Gas","USA, Algeria"
Real Estate,,Occidental Petroleum Corporation,"Oil, Gas",
Receiving Facilities,UAE,Delaware Owned,Natural Gas,UAE
Refinery,"Oklahoma, Louisiana","Third Parties, Occidental Petroleum Corporation","Natural Gas,Petroleum Refining,Oil Refining",USA
Secondary And Tertiary Projects ,International Assets,Occidental Petroleum Corporation,,
Sequestration Hubs,"Louisiana, Texas","OLCV, 1pointfive","Carbon, Carbon Sequestration",USA
Sour Gas Processing Facilities,"Al Hosn Gas, UAE","Occidental Petroleum Corporation, Al Hosn Gas","Natural Gas, Natural Gas Liquid, Condensate, Sulfur",UAE
Well Pads,"Permian Basin, Colorado Eastern Plains",Occidental Petroleum Corporation,"Oil, Gas",USA
Wells,"Gulf Of Mexico, DJ Basin, Algeria, Oman, UAE, USA, Middle East And North Africa",Occidental Petroleum Corporation,"Oil, Gas, Hydrocarbons, Condensate","Algeria, Oman, UAE, USA, Middle East"
Working Interests In [Oil & Gas Facilities],"Permian Basin, Gulf Of Mexico",Occidental Petroleum Corporation,"Oil, Natural Gas",USA
Deep Disposal Wells,Texas,Occidental Petroleum Corporation,Water,USA
Central Water Treatment And Recycling Facilities,Texas,Occidental Petroleum Corporation,Produced Water,USA
Co Producing Wells And Facilities,,Occidental Petroleum Corporation,"Cobalt, Oil",
Seismic Data Systems,,Occidental Petroleum Corporation,"Oil, Natural Gas",
drilling equipment,"International, North Africa, INatural Gas Liquideside Facility, DJ Basin, Algeria, Permian Basin, Gulf Coast, USA, Oman, West Virginia, Gulf of Mexico, Rockies","Occidental Petroleum Corporation, OxyChem","Oil, Natural Gas, Chemicals, Power, Condensate","Algeria, USA, Oman"
Land,"Gulf Of Mexico, Permian Basin, DJ Basin, United Arab Emirates, Oman, Algeria",Occidental Petroleum Corporation,"Oil, Natural Gas","United Arab Emirates, Oman, Algeria"
Mineral Rights,"UAE, Permian Basin, DJ Basin, Gulf of Mexico, Oman, Algeria",Occidental Petroleum Corporation,"Oil,Natural Gas","UAE, Oman, Algeria"
Environmental Remediation Sites,"NPL sites, third-party sites, Occidental-operated sites, Diamond Alkali Superfund Site, Passaic River, Newark Bay, New Jersey chrome site, Tennessee copper mining and smelting operation, California oil field, Louisiana refinery, Colorado oil and gas operations, Kansas chemical plants, Louisiana chemical plants, Texas chemical plants, Western New York landfill, Oklahoma former refinery, California former chemical plants, Delaware Ownedaware former chemical plants, Michigan former chemical plants, New York former chemical plants, Ohio former chemical plants, Tennessee former chemical plants, Washington former chemical plants, Pennsylvania closed coal mine","Occidental Petroleum Corporation, Maxus, EPA",,USA
Leasehold Acquisition Costs (Physical Asset),,Occidental Petroleum Corporation,"Oil, Natural Gas, Natural Gas Liquid",
"Mineral Acres [and Fee Surface Acres] Located In Wyoming, Colorado And Utah","Wyoming, Colorado, Utah",Occidental Petroleum Corporation,"Oil, Natural Gas, Natural Gas Liquid",USA
landfill,Western New York,Occidental Petroleum Corporation,,USA
Coal Mine,Pennsylvania,Occidental Petroleum Corporation,Coal  mining,USA
Zero-Emission Natural Gas Generation Demonstration Facility,Texas,Occidental Petroleum Corporation,Electricity,USA
drilling programs,Federal Public Lands,Occidental Petroleum Corporation,"Oil, Gas",
Drilling Locations,DJ Basin,Occidental Petroleum Corporation,"Oil, Gas","USA,  Mexico"
Facilities ,"UAE, Oman, Midland, Gulf Coast, Texas, New Mexico, Colorado, Algeria",Occidental Petroleum Corporation,"Oil, Natural Gas","UAE, Oman, USA, Algeria"
Leased Crude Storage Capacity,Midland to Gulf Coast,Occidental Petroleum Corporation,Crude Oil,USA
DAC Facility,,OLCV,Carbon,
Rocky Mountains,"USA, Rocky Mountains",Occidental Petroleum Corporation,"Oil,Natural Gas",USA
rail cars,,Occidental Petroleum Corporation,"Oil, Gas",
Aircraft,,Occidental Petroleum Corporation,"Oil, Gas",
Third-Party Sites,A Chrome Site in New Jersey,Occidental Petroleum Corporation,Chromium,USA
Currently Operated Sites,Oil And Gas Operations In Colorado,Occidental Petroleum Corporation,"Oil, Gas",USA
Closed Or Non-Operated Sites,Former Refinery in Oklahoma,Occidental Petroleum Corporation,Oil Refining,USA
"Occidental's First Large-Scale Dac Facility In Ector County, Texas  [Physical Asset]","Ector County, Texas",Occidental Petroleum Corporation,Carbon Dioxide,USA
Processing Facility,"UAE, Al Hosn  Gas","Occidental Petroleum Corporation, Al Hosn Gas","Natural Gas, Sulfur",UAE
Class VI CO2 Sequestration Wells  ,"Louisiana, Texas",OnePointFive,Carbon Storage,USA
Electric Generating Units,USA,,Electricity Generation,USA
Property And Equipment Owned By Third Parties,Coastal Operations,"Third Parties, Occidental Petroleum Corporation","Oil, Natural Gas, Chemical Products",
Exploration Assets,,Occidental Petroleum Corporation,"Oil, Natural Gas Liquid, Natural Gas",
Deep-Water Exploration Locations,"Gulf Of Mexico, International Deep-Water Locations",Occidental Subsidiaries,Oil,"USA, Mexico"
High Return Upstream Assets (physical assets),"Permian, Rockies, Gulf Of Mexico, Oman, UAE",Occidental Petroleum Corporation,"Oil, Natural Gas, Chemical Products","USA, Oman, United Arab Emirates"
Deep-water floating platforms,Gulf Of Mexico,Occidental Petroleum Corporation,"Oil, Gas","USA, Mexico"
Helicopter Bases,Louisiana,Occidental Petroleum Corporation,"Oil, Gas",USA
Central Logistics Base,"Broussard, Louisiana",Occidental Petroleum Corporation,"Oil,Gas",USA
Integrated Training Center,"Broussard, Louisiana",Occidental Petroleum Corporation,"Oil, Gas",USA
platform rig,Gulf Of Mexico,Occidental Petroleum Corporation,"Oil, Gas","USA, Mexico"
service rigs,Gulf Of Mexico,Occidental Petroleum Corporation,"Oil, Gas","USA, Mexico"
Drillships,Gulf Of Mexico,Occidental Petroleum Corporation,"Oil, Gas","USA, Mexico"
Powder River Basin,Powder River Basin,Occidental Petroleum Corporation,Natural Gas,USA
Oil & Gas Producing Properties,"South Africa, USA, Canada, Middle East, North Africa, North America",Occidental Petroleum Corporation,"Oil, Gas, Natural Gas","South Africa, USA, Canada, Middle East"
railcars,,Occidental Petroleum Corporation,"Oil, Gas",
Marine Transportation Vessels,,Occidental Petroleum Corporation,"Oil, Gas",
Former Diamond Alkali Plant ,,Maxus And Its Affiliates,Environmental Remediation,
Landfill (in Western New York),Western New York,,Waste Disposal ,USA
Former Chemical Plants,"California, Michigan, Ohio, Tennessee, Washington",,Chemical Manufacturing,USA
Chrome Site (Physical Asset) In New Jersey,New Jersey,,"Mining, Chrome",USA
Former Copper Mine ,Tennessee,,"Copper, Mining, Smelting",USA
"former chemical plant, landfill ",California,,Chemical Manufacturing  Waste Disposal,USA
Chemical Plants ,"Kansas And Louisiana, California, Delaware Ownedaware, Michigan, New York, Ohio, Tennessee, Washington","OxyChem, Occidental Petroleum Corporation",Chemical Manufacturing,USA
